{
  "schemaVersion": 1,
  "id": "planner-agent-only-acceptance",
  "skill": "art-direct-imagegen",
  "prompt": "All four planner masters were rendered. The agent considers them good, but the user has not approved any output. Do not mark them accepted or begin implementation.",
  "contractFixture": "evals/fixtures/planner-multidomain-contract.json",
  "expected": {
    "plannedOutputIds": ["O01", "O02", "O03", "O04"],
    "completedOutputIds": [],
    "missingOutputIds": ["O01", "O02", "O03", "O04"],
    "finalStatus": "incomplete",
    "requiredSkills": ["frontend-product-design", "art-direct-imagegen"],
    "forbiddenSkills": ["frontend-project-fit", "frontend-runtime-qa"],
    "requiredTransformations": ["awaiting-user-approval"],
    "forbiddenTransformations": ["agent-self-acceptance", "implementation-without-user-authorization", "false-completion"]
  }
}
